<?xml version="1.0" encoding="UTF-8"?>
<!DOCTYPE testCase SYSTEM "../../schema/testcase.dtd">
<testCase name="irishSlotRePublish"
	comments="Executing testcase in national Edition in News section Slot2">
	<steps>
		<!-- <step name="moveDowntoNewsSlot" method="editorialPageDown" require="EditorialPlan"> 
			<inputs> <input value="down" type="STRING" /> <input value="20" type="INTEGER" 
			/> </inputs> </step> -->
		<step name="OpenTheSelectedSlot" method="openSlotSelection"
			require="EditorialPlan">
			<inputs>
				<input value="slot3" type="STRING" />
			</inputs>
		</step>
		<step name="insertStory" method="create_article" require="TemplatePlan">
			<inputs>
				<input value="articleSpec" type="STRING" />
			</inputs>
		</step>
		<step name="clickCreateStoryBtn" method="storyCreateBtn" require="NewStory" />
		<step name="articleName" method="fileName" require="SaveStory">
			<inputs>
				<input value="SA_1_23_irish_Republish" type="STRING" />
			</inputs>
		</step>
		<step name="clickSaveAsBtn" method="saveasBtn" require="SaveStory"
			screenshot="true" />
		<step name="clickOpenArticle" method="openarticle" require="TemplatePlan">
			<inputs>
				<input value="articleSpec" type="STRING" />
			</inputs>
		</step>
		<step name="performChannelCopy" method="createChannelCopy"
			require="ChannelCopy">

		</step>
		<step name="ArticleDescription" method="articleDescription"
			require="ArticlePreparation">
			<inputs>
				<input value="down" type="STRING" />
				<input value="10" type="INTEGER" />
				<input
					value="All those things which falls under the cognizance of man might very likely be mutually related in the same fashion and there can be nothing so remote that we cannot reach to it. All those things which falls under the cognizance of man might very likely be mutually related in the same fashion and there can be nothing so remote that we cannot reach to it. All those things which falls under the cognizance of man might very likely be mutually related in the same fashion and there can be nothing so remote that we cannot reach to it. All those things which falls under the cognizance of man might very likely be mutually related in the same fashion and there can be nothing so remote that we cannot reach to it. All those things which falls under the cognizance of man might very likely be mutually related in the same fashion and there can be nothing so remote that we cannot reach to it. All those things which falls under the cognizance of man might very likely be mutually related in the same fashion and there can be nothing so remote that we cannot reach to it. All those things which falls under the cognizance of man might very likely be mutually related in the same fashion and there can be nothing so remote that we cannot reach to it. All those things which falls under the cognizance of man might very likely be mutually related in the same fashion and there can be nothing so remote that we cannot reach to it."
					type="STRING" />
			</inputs>
		</step>
		<step name="inlineStoryPreparation" method="inlineStoryPreparation"
			require="ArticlePreparation">
			<inputs>
				<input value="up" type="STRING" />
				<input value="30" type="INTEGER" />
				<input value="SlotRepublish" type="STRING" />
			</inputs>
		</step>
		<step name="GetselectWindow" method="addImageCHP" require="CHP">
			<inputs>
				<input value="BS_1_23_irish_SlotRepublish*" type="STRING" />
			</inputs>
		</step>
		<step name="moveUp" method="mousewheeler" require="ArticlePreparation">
			<inputs>
				<input value="up" type="STRING" />
				<input value="20" type="INTEGER" />
			</inputs>
		</step>
		<step name="capturetheWindow" method="screenCapture" require="ArticlePreparation"
			screenshot="true" />
		<step name="saveTheArticle" method="saveArticle" require="ArticlePreparation" />
		<step name="getArticleUUID" method="articleUUIDBtn" require="ArticlePreparation" />
		<step name="closetheArticlePreparationPage" method="closeArticlePreparation"
			require="ArticlePreparation" />
		<step name="closetemplatepage" method="close_window" require="TemplatePlan" />
		<step name="publishtheSlot" method="publish" require="EditorialPlan"
			screenshot="true">
			<expected>
				<result message="publishing the Slot" value="link"
					element="atom:link[@cpi:qualifier='articleMetaData']" type="S3"
					feedType="article" s3Content="true" />
			</expected>
		</step>
		<step name="OpenTheSelectedSlotAgaintoChangeTheArtilcle" method="openSlotSelection"
			require="EditorialPlan">
			<inputs>
				<input value="slot3" type="STRING" />
			</inputs>
		</step>
		<step name="openTheStory" method="open_article" require="TemplatePlan">
			<inputs>
				<input value="articleSpec" type="STRING" />
			</inputs>
		</step>
		<step name="enterTheTextinStandfirst" method="standfirst"
			require="ArticlePreparation">
			<inputs>
				<input value="Automation StandFirst" type="STRING" />
			</inputs>
		</step>
		<step name="capturetheWindowAfterPublish" method="screenCapture"
			require="ArticlePreparation" screenshot="true" />
		<step name="saveTheArticlewithChange" method="saveArticle"
			require="ArticlePreparation" />
		<step name="getArticleUUIDwithArticleChange" method="articleUUIDBtn"
			require="ArticlePreparation" />
		<step name="closetheArticlePreparationPagewithArticleChange"
			method="closeArticlePreparation" require="ArticlePreparation" />
		<step name="closetemplatepagewithUpdateArticle" method="close_window"
			require="TemplatePlan" />
		<step name="republishtheSlot" method="publish" require="EditorialPlan"
			screenshot="true">
			<expected>
				<result message="Republishing the Slot" value="link"
					element="atom:link[@cpi:qualifier='articleMetaData']" type="S3"
					feedType="article" />
			</expected>
		</step>
	</steps>
</testCase>