<?xml version="1.0" encoding="UTF-8"?>
<!DOCTYPE testCase SYSTEM "../../schema/testcase.dtd">
<testCase name="OpenBookSectionMetadataforIrishEdition" comments="Executing testcase in Irish edition in news book at News Cover Slot1. TC_ID: https://newsroom360.testrail.com/index.php?/tests/view/228459">
	<steps>
	<step name="selectTheSlot" method="selectSlot"
			require="EditorialPlan">
			<inputs>
				<input value="slot2" type="STRING" />
			</inputs>
		</step>
	<step name="moveDowntoNewsSlot" method="editorialPageDown"
			require="EditorialPlan">
			<inputs>
				<input value="down" type="STRING" />
				<input value="10" type="INTEGER" />
			</inputs>
		</step>
	<step name="selectSlot" method="selectSlot" require="EditorialPlan">
			<inputs>
				<input value="slot1" type="STRING" />
			</inputs>
		</step>
	<step name="OpenBookSectionSlotMetadata" method="stBookSectionMetadata" require="EditorialPlan"/>
	<step name="captureBookSectionSlotMetadata" method="screenCapture" require="EditorialPlan" screenshot="true"/>
	</steps>
</testCase>