<?xml version="1.0" encoding="UTF-8"?>
<!DOCTYPE testCase SYSTEM "../../schema/testcase.dtd">
<testCase name="STEditionCreationIreland"  comments="Creating edition for Irishedition in Sundaytimes. TC_ID:https://newsroom360.testrail.com/index.php?/tests/view/228527">
	<steps>
		<step name="ExpandingIrishPublishing" method="irishPlanExtend"
			require="EditorialPlan" />
		<step name="ClcikingOnIrishMainBook" method="irishMainbookBtn"
			require="EditorialPlan" />
		<step name="slotSelectionNewsBook" method="selectSlot" require="EditorialPlan">
			<inputs>
				<input value="slot2" type="STRING" />
			</inputs>
		</step>
		<step name="selectingallSlotforNews" method="selectAllSlot"
			require="EditorialPlan" />
		<step name="creatingtheSlotDWPforNewsSlot" method="slotSelection"
			require="EditorialPlan">
			<inputs>
				<input value="slot2" type="STRING" />
			</inputs>
		</step>
		<step name="slotSelectionNews" method="selectSlot" require="EditorialPlan">
			<inputs>
				<input value="slot1" type="STRING" />
			</inputs>
		</step>
		<step name="clickingOnSportsBook" method="stSportsIreland"
			require="STEditionCreation" />
		<step name="slotSelectionSportsBook" method="selectSlot" require="EditorialPlan">
			<inputs>
				<input value="slot2" type="STRING" />
			</inputs>
		</step>
		<step name="selectingallSlotforSports" method="selectAllSlot"
			require="EditorialPlan" />
		<step name="creatingtheSlotDWPforSportsSlot" method="slotSelection"
			require="EditorialPlan">
			<inputs>
				<input value="slot2" type="STRING" />
			</inputs>
		</step>
		<step name="slotSelectionSports" method="selectSlot" require="EditorialPlan">
			<inputs>
				<input value="slot1" type="STRING" />
			</inputs>
		</step>
		<step name="navigationtoMagazineBook" method="rightNavigation"
			require="STEditionCreation" />
		<step name="clickonMagazine" method="stOtherIrelandBooks"
			require="STEditionCreation" />
		<step name="slotSelectionMagazineBook" method="selectSlot"
			require="EditorialPlan">
			<inputs>
				<input value="slot2" type="STRING" />
			</inputs>
		</step>
		<step name="selectingallSlotforMagazine" method="selectAllSlot"
			require="EditorialPlan" />
		<step name="creatingtheSlotDWPforMagazineSlot" method="slotSelection"
			require="EditorialPlan">
			<inputs>
				<input value="slot2" type="STRING" />
			</inputs>
		</step>
		<step name="slotSelectionMagazine" method="selectSlot" require="EditorialPlan">
			<inputs>
				<input value="slot1" type="STRING" />
			</inputs>
		</step>
		<step name="navigationtoBuisnessBook" method="rightNavigation"
			require="STEditionCreation" />
		<step name="clickonBuisness" method="stOtherIrelandBooks"
			require="STEditionCreation" />
		<step name="slotSelectionBuisnessBook" method="selectSlot"
			require="EditorialPlan">
			<inputs>
				<input value="slot2" type="STRING" />
			</inputs>
		</step>
		<step name="selectingallSlotforBuisness" method="selectAllSlot"
			require="EditorialPlan" />
		<step name="creatingtheSlotDWPforBuisnessSlot" method="slotSelection"
			require="EditorialPlan">
			<inputs>
				<input value="slot2" type="STRING" />
			</inputs>
		</step>
		<step name="navigationtoNewsReviewBook" method="rightNavigation"
			require="STEditionCreation" />
		<step name="clickonNewsReview" method="stOtherIrelandBooks"
			require="STEditionCreation" />
		<step name="slotSelectionNewsReviewBook" method="selectSlot"
			require="EditorialPlan">
			<inputs>
				<input value="slot2" type="STRING" />
			</inputs>
		</step>
		<step name="selectingallSlotforNewsReview" method="selectAllSlot"
			require="EditorialPlan" />
		<step name="creatingtheSlotDWPforNewsReviewSlot" method="slotSelection"
			require="EditorialPlan">
			<inputs>
				<input value="slot2" type="STRING" />
			</inputs>
		</step>
		<step name="navigationtoSDSunday" method="rightNavigation"
			require="STEditionCreation" />
		<step name="clickonSDSunday" method="stOtherIrelandBooks"
			require="STEditionCreation" />
		<step name="slotSelectionSDSundayBook" method="selectSlot"
			require="EditorialPlan">
			<inputs>
				<input value="slot2" type="STRING" />
			</inputs>
		</step>
		<step name="selectingallSlotforSDSunday" method="selectAllSlot"
			require="EditorialPlan" />
		<step name="creatingtheSlotDWPforSDSundaySlot" method="slotSelection"
			require="EditorialPlan">
			<inputs>
				<input value="slot2" type="STRING" />
			</inputs>
		</step>
		<step name="navigationtoCultureBook" method="rightNavigation"
			require="STEditionCreation" />
		<step name="clickonCulture" method="stOtherIrelandBooks"
			require="STEditionCreation" />
		<step name="slotSelectionCultureBook" method="selectSlot"
			require="EditorialPlan">
			<inputs>
				<input value="slot2" type="STRING" />
			</inputs>
		</step>
		<step name="selectingallSlotforCulture" method="selectAllSlot"
			require="EditorialPlan" />
		<step name="creatingtheSlotDWPforCultureSlot" method="slotSelection"
			require="EditorialPlan">
			<inputs>
				<input value="slot2" type="STRING" />
			</inputs>
		</step>
		<step name="navigationtoStyleBook" method="rightNavigation"
			require="STEditionCreation" />
		<step name="clickonStyle" method="stOtherIrelandBooks" require="STEditionCreation" />
		<step name="slotSelectionStyleBook" method="selectSlot" require="EditorialPlan">
			<inputs>
				<input value="slot2" type="STRING" />
			</inputs>
		</step>
		<step name="selectingallSlotforStyle" method="selectAllSlot"
			require="EditorialPlan" />
		<step name="creatingtheSlotDWPforStyleSlot" method="slotSelection"
			require="EditorialPlan">
			<inputs>
				<input value="slot2" type="STRING" />
			</inputs>
		</step>
		<step name="navigationtoTravelBook" method="rightNavigation"
			require="STEditionCreation" />
		<step name="clickonTravelBook" method="stTravelIrelandBooks" require="STEditionCreation" />
		<step name="slotSelectionTravelBook" method="selectSlot" require="EditorialPlan">
			<inputs>
				<input value="slot2" type="STRING" />
			</inputs>
		</step>
		<step name="selectingallSlotforTravelBook" method="selectAllSlot"
			require="EditorialPlan" />
		<step name="creatingtheSlotDWPforTravelBookSlot" method="slotSelection"
			require="EditorialPlan">
			<inputs>
				<input value="slot2" type="STRING" />
			</inputs>
		</step>
		<step name="navigationtoSundayClubBook" method="rightNavigation"
			require="STEditionCreation" />
		<step name="clickonSundayClub" method="stTravelIrelandBooks"
			require="STEditionCreation" />
		<step name="slotSelectionSundayClubBook" method="selectSlot" require="EditorialPlan">
			<inputs>
				<input value="slot2" type="STRING" />
			</inputs>
		</step>
		<step name="selectingallSlotforSundayClub" method="selectAllSlot"
			require="EditorialPlan" />
		<step name="creatingtheSlotDWPforSundayClubSlot" method="slotSelection"
			require="EditorialPlan">
			<inputs>
				<input value="slot2" type="STRING" />
			</inputs>
		</step>
		<step name="navigationtoNews" method="leftNavigation" require="STEditionCreation" />
		<step name="clickingOnNewsBook" method="stNewsIreland" require="STEditionCreation" />
		<step name="NavigateToWorkflowWindow" method="workflowIrish"
			require="EditorialPlan" />
		<step name="ChangeTheEditionToInprogress" method="editorialPlanInProgress"
			require="EditorialWorkFlow" />
		<step name="openPropertyWindow" method="propertyWindowIrish"
			require="EditorialPlan" />
		<step name="selectingPropertyUUID" method="gettingEditionPropertyUuid"
			require="PropertyWindow">
			<expected>
				<result message="vaidating News Book is Created"
					value="link" element="atom:link[@title='News']" type="S3" feedType="edition" />
				<result message="vaidating Sport Book is Created" value="link"
					element="atom:link[@title='Sport']" type="S3" feedType="edition" />
				<result message="vaidating Magazine Book is Created"
					value="link" element="atom:link[@title='Magazine']" type="S3"
					feedType="edition" />
				<result message="vaidating Buisness Book is Created" value="link"
					element="atom:link[@title='Business']" type="S3" feedType="edition" />
				<result message="vaidating News Review Book is Created"
					value="link" element="atom:link[@title='News Review']" type="S3"
					feedType="edition" />
				<result message="vaidating Style Book is Created" value="link"
					element="atom:link[@title='Style']" type="S3" feedType="edition" />
				<result message="vaidating Travel Book is Created"
					value="link" element="atom:link[@title='Travel']" type="S3"
					feedType="edition" />
				<result message="vaidating Culture Book is Created" value="link"
					element="atom:link[@title='Culture']" type="S3" feedType="edition" />
			</expected>
		</step>
	</steps>
</testCase>