<?xml version="1.0" encoding="UTF-8"?>
<!DOCTYPE testCase SYSTEM "../../schema/testcase.dtd">
<testCase name="SundayTimesIrishHeadlineSpanText2"
	comments="Executing the testcase in Irish Edition Sports book at Sport/Sport Section at Slot5. TC_ID: https://newsroom360.testrail.com/index.php?/tests/view/228263">
	<steps>
		<step name="OpenTheSelectedSlot" method="openSlotSelection"
			require="EditorialPlan">
			<inputs>
				<input value="slot2" type="STRING" />
			</inputs>
		</step>
		<step name="gettingQuickAccess" method="methodeQuery" require="TemplatePlan" />
		<step name="fileName" method="dwpMethodeQuery" require="NewSearchQuery">
			<inputs>
				<input value="SA_1_30_ST_irishheadlinspan2*" type="STRING" />
				<input value="articleSpec" type="STRING" />
			</inputs>
		</step>
		<step name="CheckingWindow" method="checkChannelCopyWindow"
			require="CHP" />
		<step name="GetselectWindow" method="addImageCHP" require="CHP">
			<inputs>
				<input value="BS_1_30_ST_irish_headlinspan2*" type="STRING" />
			</inputs>
		</step>
		<step name="openQuickMetadata" method="quickmetadata" require="ArticlePreparation" />
		<step name="Selectingthetablettab" method="selectingTablet"
			require="QuickMetadataTablet" />
		<step name="selectingHeadlineSpanText2" method="headlineSpanDropDownnumber"
			require="QuickMetadataTablet" screenshot="true">
			<inputs>
				<input value="1" type="INTEGER" />
			</inputs>
		</step>
		<step name="clickingQuickMetadataSaveButton" method="saveBtnPosition"
			require="QuickMetadataTablet" />
		<step name="saveTheArticle" method="saveArticle" require="ArticlePreparation" />
		<step name="getArticleUUID" method="articleUUIDBtn" require="ArticlePreparation" />
		<step name="closetheArticlePreparationPage" method="closeArticlePreparation"
			require="ArticlePreparation" />
		<step name="closetemplatepage" method="close_window" require="TemplatePlan" />
		<step name="publishtheSlot" method="stPublish" require="EditorialPlan"
			screenshot="true">
			<expected>
				<result message="Article Headline Should hide" value="2"
					element="cpi:headlineSpan" type="S3" feedType="articleMetadata" />
			</expected>
		</step>
	</steps>
</testCase>