<?xml version="1.0" encoding="UTF-8"?>
<!DOCTYPE testCase SYSTEM "../../schema/testcase.dtd">
<testCase name="ChildArticleBluePanel">
	<steps>
		<!-- <step name="openselectedslot" method="openSlotSelection" require="EditorialPlan">
			<inputs>
				<input value="slot4" type="STRING" />
			</inputs>
		</step>
		<step name="clickOpenArticle" method="openarticle" require="TemplatePlan">
			<inputs>
				<input value="articleSpec" type="STRING" />
			</inputs>
		</step> -->
		<step name="openselectedslot" method="openSlotSelection" require="EditorialPlan">
			<inputs>
				<input value="slot4" type="STRING" />
			</inputs>
		</step>
		<step name="launchCandidateBrowser" method="candidateBrowser"
			require="TemplatePlan">
		</step>
		<step name="addStoryToChildArticle" method="dragExistingStory" require="TemplatePlan">
		</step>
		<step name="clickOpenArticle" method="openarticle" require="TemplatePlan">
			<inputs>
				<input value="childArticle" type="STRING" />
			</inputs>
		</step>
		<step name="openQuickMetadata" method="quickmetadata" require="ArticlePreparation" />
		<step name="Selectingthetablettab" method="selectingTablet"
			require="QuickMetadataTablet" />
		<step name="childArticlePanel" method="panelSettings"
			require="QuickMetadataTablet" />
		<step name="saveandPublishtheArticle" method="publishArticle"
			require="ArticlePreparation" />
		<step name="getArticleUUID" method="articleUUIDBtn" require="ArticlePreparation" />
		<step name="closetheArticlePreparationPage" method="closeArticlePreparation"
			require="ArticlePreparation" />
		<step name="closetemplatepage" method="close_window" require="TemplatePlan" />
		<step name="navigatingtoTabPageFlow" method="releasePage"
			require="EditorialPlan">
			<inputs>
				<input value="slot4" type="STRING" />
			</inputs>
		</step>
		<step name="clickingontheStatus" method="tabPageFlow" require="TabPageFlow">
			<inputs>
				<input value="3" type="INTEGER" />
			</inputs>
		</step>
		<step name="navigatingtoWorkFlowWindow" method="workflowNational"
			require="EditorialPlan" />
		<step name="ChangingStatustoDone" method="editorialPlanDoneStatus"
			require="EditorialWorkFlow" />
		<step name="publishtheSlot" method="publish" require="EditorialPlan">
		<expected>
				<result message="Panel should set as blue" value="bluePanel"
					element="cpi:style" type="S3" feedType="articleMetadata" />
			</expected>
		</step>
	</steps>
</testCase>