<?xml version="1.0" encoding="UTF-8"?>
<!DOCTYPE testCase SYSTEM "../../schema/testcase.dtd">
<testCase name="SundayTimesIrishHeadlineTextAllignmentLeft"
	comments="Executing the test case in Business Book at Business Page Section at Slot4. TC_ID: https://newsroom360.testrail.com/index.php?/tests/view/228288">
	<steps>
		<!-- <step name="navigationtoStyleBook" method="rightNavigation"
			require="STEditionCreation" />
		<step name="clickonStyle" method="stOtherNationalBooks" require="STEditionCreation" />
		<step name="slotSelectionStyleBook" method="selectSlot" require="EditorialPlan">
			<inputs>
				<input value="slot2" type="STRING" />
			</inputs>
		</step> -->
		<step name="moveDowntoNewsSlot" method="editorialPageDown"
			require="EditorialPlan">
			<inputs>
				<input value="down" type="STRING" />
				<input value="10" type="INTEGER" />
			</inputs>
		</step>
		<step name="OpenTheSelectedSlot" method="openSlotSelection"
			require="EditorialPlan">
			<inputs>
				<input value="slot1" type="STRING" />
			</inputs>
		</step>
		<step name="gettingQuickAccess" method="methodeQuery" require="TemplatePlan" />
		<step name="fileName" method="dwpMethodeQuery" require="NewSearchQuery">
			<inputs>
				<input value="SA_1_15_st_irish_Headline_left*" type="STRING" />
				<input value="articleSpec" type="STRING" />
			</inputs>
		</step>
		<step name="CheckingWindow" method="checkChannelCopyWindow"
			require="CHP" />
		<step name="GetselectWindow" method="addImageCHP" require="CHP">
			<inputs>
				<input value="BS_1_15_st_irish_Headline_left*" type="STRING" />
			</inputs>
		</step>
		<step name="saveArticle" method="saveArticle" require="ArticlePreparation" />
		<step name="openQuickMetadata" method="quickmetadata" require="ArticlePreparation" />
		<step name="Selectingthetablettab" method="selectingTablet"
			require="QuickMetadataTablet" />
		<step name="HeadlineTextAllignmentfromLefttoRight" method="headlineSpanDropDownPosition"
			require="QuickMetadataTablet" screenshot="true">
			<inputs>
				<input value="2" type="INTEGER" />
			</inputs>
		</step>
		<step name="clickingQuickMetadataSaveButton" method="saveBtnPosition"
			require="QuickMetadataTablet" />
		<step name="getArticleUUID" method="articleUUIDBtn" require="ArticlePreparation" />
		<step name="closetheArticlePreparationPage" method="closeArticlePreparation"
			require="ArticlePreparation" />
		<step name="closetemplatepage" method="close_window" require="TemplatePlan" />
		<step name="publishtheSlot" method="stPublish" require="EditorialPlan"
			screenshot="true">
			<expected>
				<result message="Headline Text Allignment Should be Right"
					value="right" element="cpi:headlineTextAlignment" type="S3"
					feedType="articleMetadata" s3Content="true" />
			</expected>
		</step>
		<step name="openselectedslotforChangingingArticleheadlineAlignment"
			method="openSlotSelection" require="EditorialPlan">
			<inputs>
				<input value="slot1" type="STRING" />
			</inputs>
		</step>
		<step name="OpenArticle" method="openarticle" require="TemplatePlan">
			<inputs>
				<input value="articleSpec" type="STRING" />
			</inputs>
		</step>
		<step name="saveArticleforleftallignment" method="saveArticle"
			require="ArticlePreparation" />
		<step name="OpenQuickAcess" method="getQuickAccessBar" require="ArticlePreparation" />
		<step name="openQuickMetadataforMetadataChange" method="quickmetadata"
			require="ArticlePreparation" />
		<step name="SelectingthetablettabforMetadataChange" method="selectingTablet"
			require="QuickMetadataTablet" />
		<step name="HeadlineTextAllignmentfromRighttoLeft" method="headlineSpanDropDownPositionUp"
			require="QuickMetadataTablet" screenshot="true">
			<inputs>
				<input value="2" type="INTEGER" />
			</inputs>
		</step>
		<step name="clickingQuickMetadataSaveButtonForLeftAlignment"
			method="saveBtnPosition" require="QuickMetadataTablet" />
		<step name="closetheArticlePreparationPagewithMetadatachanges"
			method="closeArticlePreparation" require="ArticlePreparation" />
		<step name="closetemplatepagewithMetadatachanges" method="close_window"
			require="TemplatePlan" />
		<step name="publishtheSlotwithMetadatachanges" method="stPublish"
			require="EditorialPlan" screenshot="true">
			<expected>
				<result message="Headline Text Allignment Should be Left"
					value="left" element="cpi:headlineTextAlignment" type="S3"
					feedType="articleMetadata" />
			</expected>
		</step>
	</steps>
</testCase>