<?xml version="1.0" encoding="UTF-8"?>
<!DOCTYPE testCase SYSTEM "../../schema/testcase.dtd">
<testCase name="DisableSavingArticle" comments="Executing the testcase in Law Section at Slot1">
	<steps>
		<!-- <step name="movedown" method="editorialPageDown" require="EditorialPlan">
			<inputs>
				<input value="down" type="STRING" />
				<input value="30" type="INTEGER" />
			</inputs>
		</step> -->
		<step name="OpenTheSelectedSlot" method="openSlotSelection"
			require="EditorialPlan">
			<inputs>
				<input value="slot3" type="STRING" />
			</inputs>
		</step>
		<step name="gettingQuickAccess" method="methodeQuery" require="TemplatePlan" />
		<step name="fileName" method="dwpMethodeQuery" require="NewSearchQuery">
			<inputs>
				<input value="SA_Metadata_true*" type="STRING" />
				<input value="articleSpec" type="STRING" />
			</inputs>
		</step>
		<step name="CheckingWindow" method="checkChannelCopyWindow"
			require="CHP" />
		<step name="GetselectWindow" method="addImageCHP" require="CHP">
			<inputs>
				<input value="BS_Metadata_true*" type="STRING" />
			</inputs>
		</step>
		<step name="openQuickMetadata" method="quickmetadata" require="ArticlePreparation" />
		<step name="selectingTheTabletTab" method="selectingTablet"
			require="QuickMetadataTablet" />

		<step name="clickOnDisableSavingArticle" method="disableSavingArticle"
			require="QuickMetadataTablet">
		</step>
		<step name="savetheChangesDoneinQuickMetadata" method="saveBtnPosition" require="QuickMetadataTablet" />
		<step name="saveandPublishtheArticle" method="saveArticle"
			require="ArticlePreparation" />
		<step name="getArticleUUID" method="articleUUIDBtn" require="ArticlePreparation" />
		<step name="closetheArticlePreparationPage" method="closeArticlePreparation"
			require="ArticlePreparation" />
		<step name="closetemplatepage" method="close_window" require="TemplatePlan" />
		<step name="publishtheSlot" method="publish" require="EditorialPlan">
		<expected>
				<result message="Saving Article Should hide" value="true"
					element="cpi:hideSaving" type="S3" feedType="articleMetadata" />
			</expected>
		</step>
	</steps>
</testCase>